{
  "title": "Pressure Cooker Red Lentil Curry",
  "emoji": "üçõ",
  "subtitle": "A creamy, golden soup-stew. Boosted with spinach for 50% veg. Serve over Quinoa for lower GI.",
  "prep": {
    "ready_to_use": [
      {"amount": "1 cup", "name": "Red Lentils", "note": "Rinsed well"},
      {"amount": "2 cups", "name": "Frozen Spinach", "note": "Or fresh baby spinach"},
      {"amount": "1 can (13.5 oz)", "name": "Coconut Milk"},
      {"amount": "1.5 cups", "name": "Water", "note": "Use Softened Water (hard water prevents softening)"},
      {"amount": "1 tbsp", "name": "Cumin"},
      {"amount": "1 tsp", "name": "Turmeric"},
      {"amount": "1 tbsp", "name": "Coconut Oil"}
    ],
    "knife_work": [
      {"amount": "1", "name": "Onion", "prep": "diced small"},
      {"amount": "1 tbsp", "name": "Fresh Ginger", "prep": "minced or grated"},
      {"amount": "2 cloves", "name": "Garlic", "prep": "minced"}
    ]
  },
  "steps": [
    {
      "minutes_before_done": 35,
      "duration_minutes": 5,
      "ingredients": [
        {"amount": "1", "name": "Onion"},
        {"amount": "1 tbsp", "name": "Ginger"},
        {"amount": "2 cloves", "name": "Garlic"}
      ],
      "action_name": "Mise en Place",
      "action_description": "Dice onion. Mince fresh ginger and garlic. Rinse lentils under cold water until water runs clear."
    },
    {
      "minutes_before_done": 30,
      "duration_minutes": 5,
      "ingredients": [
        {"amount": "1 tbsp", "name": "Coconut Oil"},
        {"amount": "1", "name": "Onion"},
        {"amount": "Spices", "name": "Cumin/Turmeric"}
      ],
      "action_name": "Saut√© Aromatics",
      "action_description": "Set Instant Pot to Saut√©. Cook onion until soft (3m). Add ginger, garlic, spices. Cook 1m until very fragrant but not burning."
    },
    {
      "minutes_before_done": 25,
      "duration_minutes": 1,
      "ingredients": [
        {"amount": "1 cup", "name": "Red Lentils"},
        {"amount": "1.5 cups", "name": "Water"}
      ],
      "action_name": "Pressure Cook",
      "action_description": "Add lentils and water. Scrape bottom firmly to remove brown bits (prevents burn warning). Seal lid. High Pressure for 5 minutes.",
      "meanwhile": { "ingredients": "Quinoa", "action": "Start Quinoa (lower GI than rice)" }
    },
    {
      "minutes_before_done": 10,
      "duration_minutes": 10,
      "ingredients": [],
      "action_name": "Natural Release",
      "action_description": "Allow 10 min natural release, then quick release remaining steam."
    },
    {
      "minutes_before_done": 0,
      "duration_minutes": 2,
      "ingredients": [
        {"amount": "1 can (13.5 oz)", "name": "Coconut Milk"},
        {"amount": "2 cups", "name": "Frozen Spinach"},
        {"amount": "To taste", "name": "Salt/Lime"}
      ],
      "action_name": "Finish",
      "action_description": "Stir in coconut milk and frozen spinach. The residual heat will melt/cook the spinach instantly. Season with salt. Serve over Quinoa.",
      "meanwhile": { "ingredients": "Kids Bowl", "action": "PULL: Portion before adding spinach if they are green-averse (though it hides well!)" }
    }
  ]
}
