{
  "title": "Creamy Sesame-Hemp Steak & Cauliflower Skillet",
  "emoji": "🥩🥘",
  "prep": {
    "ready_to_use": [
      {"amount": "1.5 lbs", "name": "Sirloin Tip Steak", "prep": "sliced thin across the grain"},
      {"amount": "1 tbsp", "name": "Olive Oil"},
      {"amount": "1 tbsp", "name": "Butter"},
      {"amount": "2 tbsp", "name": "Lemon or Lime juice"},
      {"amount": "1/2 cup", "name": "Greek Yogurt"},
      {"amount": "3 tbsp", "name": "Sesame Seeds", "prep": "toasted and pulsed in coffee grinder until coarse"},
      {"amount": "2 tbsp", "name": "Hemp Hearts"},
      {"amount": "1/2 tsp", "name": "Nigella Seeds"},
      {"amount": "1/2 cup", "name": "Freezer Seed Mix"},
      {"amount": "1 tsp", "name": "Aleppo Pepper"},
      {"amount": "2 cloves", "name": "Garlic", "prep": "minced or from jar"},
      {"amount": "1/2 tsp", "name": "Cumin"},
      {"amount": "1/4 cup", "name": "Beef or Veggie Bouillon (Liquid)"}
    ],
    "knife_work": [
      {"amount": "1 head", "name": "Cauliflower", "prep": "chopped into small florets for quick sautéing"},
      {"amount": "2", "name": "Bell Peppers", "prep": "diced small"},
      {"amount": "1", "name": "Yellow Onion", "prep": "diced small"}
    ]
  },
  "steps": [
    {
      "minutes_before_done": 40,
      "duration_minutes": 10,
      "ingredients": [
        {"amount": "1", "name": "Cauliflower"},
        {"amount": "2", "name": "Bell Peppers"},
        {"amount": "1", "name": "Yellow Onion"},
        {"amount": "1.5 lbs", "name": "Sirloin Tip Steak"},
        {"amount": "3 tbsp", "name": "Sesame Seeds"}
      ],
      "action_name": "Mise en Place",
      "action_description": "Dice onion, peppers, and cauliflower small. Thinly slice the partially frozen steak *across the grain* into short strips. Toast sesame seeds in the skillet until fragrant, then pulse them in the coffee grinder until they form a coarse, nutty powder.",
      "meanwhile": { "ingredients": "Freezer Seed Mix", "action": "set aside for garnish" }
    },
    {
      "minutes_before_done": 30,
      "duration_minutes": 5,
      "ingredients": [
        {"amount": "1.5 lbs", "name": "Steak Strips"},
        {"amount": "1 tbsp", "name": "Butter"},
        {"amount": "1 tbsp", "name": "Olive Oil"}
      ],
      "action_name": "Hard Sear",
      "action_description": "Heat a heavy skillet until very hot. Add oil and butter, then sear steak strips in a single layer until browned (about 1-2 mins per side). Remove from pan and set aside. PULL: Set aside plain steak strips for kids.",
      "meanwhile": { "ingredients": "Aleppo Pepper", "action": "sprinkle half over adult steak" }
    },
    {
      "minutes_before_done": 25,
      "duration_minutes": 15,
      "ingredients": [
        {"amount": "1", "name": "Cauliflower"},
        {"amount": "2", "name": "Bell Peppers"},
        {"amount": "1", "name": "Yellow Onion"},
        {"amount": "1/4 cup", "name": "Bouillon"},
        {"amount": "1/2 tsp", "name": "Cumin"},
        {"amount": "2 cloves", "name": "Garlic"}
      ],
      "action_name": "Sauté & Simmer Veggies",
      "action_description": "In the same skillet, sauté onion and peppers for 5 mins. Add cauliflower florets, garlic, and cumin. Deglaze with bouillon (or a splash of water), cover, and steam for 5-8 mins until cauliflower is tender but not mushy. PULL: Set aside plain cauliflower for kids.",
      "meanwhile": { "ingredients": "Greek Yogurt", "action": "mix with lime juice and ground sesame seeds" }
    },
    {
      "minutes_before_done": 10,
      "duration_minutes": 5,
      "ingredients": [
        {"amount": "1/2 cup", "name": "Greek Yogurt / Sesame Mix"},
        {"amount": "2 tbsp", "name": "Hemp Hearts"},
        {"amount": "1/2 tsp", "name": "Nigella Seeds"},
        {"amount": "1.5 lbs", "name": "Seared Steak"}
      ],
      "action_name": "The Creamy Fold",
      "action_description": "Lower heat to medium-low. Return seared steak to the skillet. Gently fold in the Greek yogurt/sesame mix, hemp hearts, and nigella seeds. Stir until a creamy, velvety sauce coats everything. Do not boil (to prevent yogurt from curdling).",
      "meanwhile": { "ingredients": "Lime Juice", "action": "final squeeze for brightness" }
    },
    {
      "minutes_before_done": 0,
      "duration_minutes": 2,
      "ingredients": [
        {"amount": "1/2 cup", "name": "Freezer Seed Mix"}
      ],
      "action_name": "Serve & Garnish",
      "action_description": "Portion the creamy steak and cauliflower into bowls. Top each bowl with a heavy hit of the Freezer Seed Mix for extra crunch and fiber. Finish with remaining Aleppo pepper for a smoky kick.",
      "meanwhile": { "ingredients": "Cilantro", "action": "garnish if available" }
    }
  ]
}
