{
  "title": "Coconut Dill Chicken Stew",
  "emoji": "ü••",
  "subtitle": "Creamy, golden, and packed with fresh herbs.",
  "servings": 4,
  "total_time_minutes": 30,
  "prep": {
    "ready_to_use": [
      { "amount": "1.5 lbs", "name": "Braised Chicken Thighs", "note": "frozen or thawed" },
      { "amount": "1 can", "name": "Coconut Milk", "note": "full fat" },
      { "amount": "2 cups", "name": "Frozen Spinach" },
      { "amount": "1 bunch", "name": "Fresh Dill", "note": "chopped" },
      { "amount": "1 cup", "name": "Rice", "note": "for serving" }
    ],
    "knife_work": [
      { "amount": "1 medium", "name": "Onion", "prep": "Dice" },
      { "amount": "2-3", "name": "Carrots", "prep": "Dice small" },
      { "amount": "3 cloves", "name": "Garlic", "prep": "Minced" },
      { "amount": "1 inch", "name": "Ginger", "prep": "Grated (or 1 tsp powder)" }
    ]
  },
  "steps": [
    {
      "minutes_before_done": 30,
      "duration_minutes": 5,
      "action_name": "Start Rice",
      "action_description": "Get the rice going in a separate pot or rice cooker.",
      "ingredients": [
        { "amount": "1 cup", "name": "Rice" },
        { "amount": "1.5 cups", "name": "Water/Broth" }
      ],
      "meanwhile": {
        "ingredients": "Chicken",
        "action": "Run frozen bag under cold water to loosen."
      }
    },
    {
      "minutes_before_done": 25,
      "duration_minutes": 5,
      "action_name": "Saut√© Aromatics",
      "action_description": "Heat oil in a large pot. Saut√© onion and carrots until softening.",
      "ingredients": [
        { "amount": "1 tbsp", "name": "Oil" },
        { "amount": "1", "name": "Onion" },
        { "amount": "2", "name": "Carrots" }
      ]
    },
    {
      "minutes_before_done": 20,
      "duration_minutes": 2,
      "action_name": "Bloom Spices",
      "action_description": "Add garlic, ginger, and spices. Cook 1 min until fragrant.",
      "ingredients": [
        { "amount": "3 cloves", "name": "Garlic" },
        { "amount": "1 inch", "name": "Ginger" },
        { "amount": "1 tsp", "name": "Turmeric" },
        { "amount": "1/2 tsp", "name": "Red Pepper Flakes" }
      ]
    },
    {
      "minutes_before_done": 18,
      "duration_minutes": 13,
      "action_name": "Simmer Base",
      "action_description": "Add coconut milk and chicken. Simmer gently to heat chicken through.",
      "ingredients": [
        { "amount": "1 can", "name": "Coconut Milk" },
        { "amount": "All", "name": "Braised Chicken" },
        { "amount": "Splash", "name": "Water/Broth" }
      ]
    },
    {
      "minutes_before_done": 5,
      "duration_minutes": 5,
      "action_name": "Finish & Serve",
      "action_description": "Stir in spinach (wilts instantly) and dill. Season with salt and fresh lime juice.",
      "ingredients": [
        { "amount": "2 cups", "name": "Spinach" },
        { "amount": "1 bunch", "name": "Fresh Dill" },
        { "amount": "1", "name": "Lime (juiced)" }
      ]
    }
  ]
}
